nome,nota,setor,data_ingestao
Prefeitura Municipal de Verdejante,"4,0",Agências municipais,2025-04-08
Prefeitura Municipal de Demerval Lobão,"5,0",Agências municipais,2025-04-08
Município de Bom Jesus do Oeste,"5,0",Agências municipais,2025-04-08
Município de Cunha Porã,"5,0",Agências municipais,2025-04-08
Embassy of Switzerland in Brazil,"5,0",Agências municipais,2025-04-08
Prefeitura Municipal de Demerval Lobão,"5,0",Agências municipais,2025-04-08
Fundação Marimbeta de Itabuna,"5,0",Agências municipais,2025-04-08
PrefeituraMunicipal de São Gonçalo do Gurguéia,"5,0",Agências municipais,2025-04-08
Secretaria Municipal de Saúde de Santa Maria da Boa Vista,"4,0",Agências municipais,2025-04-08
Parque Tecnológico de São José do Rio Preto,"5,0",Agências municipais,2025-04-08
Prefeitura Municipal de Espumoso,"4,0",Agências municipais,2025-04-08
Prefeitura Municipal de Itamari,"5,0",Agências municipais,2025-04-08
Secretaria Municipal de Educação de Caieiras,"4,0",Agências municipais,2025-04-08
Prefeitura Municipal de Virmond,"4,0",Agências municipais,2025-04-08
Companhia de Desenvolvimento de Aparecida,"5,0",Agências municipais,2025-04-08
Prefeitura Municipal de Santa rosa da serra,"5,0",Agências municipais,2025-04-08
Centro de Instrução de Aviação do Exército,"5,0",Agências municipais,2025-04-08
Governo Municipal de Morrinhos,"5,0",Agências municipais,2025-04-08
Academia Usina,"4,0",Agências municipais,2025-04-08
Prefeitura Municipal de Paraopeba,"5,0",Agências municipais,2025-04-08
Câmara Municipal de Açailândia,"5,0",Agências municipais,2025-04-08
Prefeitura municipal de sericita,"4,0",Agências municipais,2025-04-08
Colegio Estadual Idelzito Eloy De Abreu,"5,0",Agências municipais,2025-04-08
Diretoria de Ensino de São Roque,"5,0",Agências municipais,2025-04-08
Secretaria Municipal de Urbanismo e Meio Ambiente,"4,0",Agências municipais,2025-04-08
Companhia de Desenvolvimento de Aparecida,"5,0",Agências municipais,2025-04-08
Chapecó Secretaria de Educação,"5,0",Agências municipais,2025-04-08
Prefeitura Municipal de São Miguel do Gostoso,"5,0",Agências municipais,2025-04-08
Instituto de Desenvolvimento do Norte e Nordeste de Minas Gerais,"5,0",Agências municipais,2025-04-08
Prefeitura Municipal de Ribeirão do Sul,"5,0",Agências municipais,2025-04-08
Prefeitura Municipal de Joanésia,"4,0",Agências municipais,2025-04-08
Prefeitura de São Domingos do Cariri,"5,0",Agências municipais,2025-04-08
Juizado Especial Federal,"5,0",Agências municipais,2025-04-08
Superintendência Regional de Ensino de Ouro Preto,"5,0",Agências municipais,2025-04-08
Diretoria Regional de Educação Pirituba/Jaraguá,"5,0",Agências municipais,2025-04-08
Prefeitura de São Domingos do Cariri,"5,0",Agências municipais,2025-04-08
Câmara Municipal de Canaã dos Carajas,"5,0",Agências municipais,2025-04-08
Diretoria Regional de Educação Pirituba/Jaraguá,"5,0",Agências municipais,2025-04-08
Prefeitura Municipal de Paraibano,"5,0",Agências municipais,2025-04-08
Instituto de Desenvolvimento do Norte e Nordeste de Minas Gerais,"5,0",Agências municipais,2025-04-08
Prefeitura Municipal de Tarumirim,"5,0",Agências municipais,2025-04-08
Central Estadual de Transplantes de Goiás,"5,0",Agências municipais,2025-04-08
Prefeitura de Sabino,"4,4",Agências municipais,2025-04-08
Câmara Municipal de Barra do Garças,"5,0",Agências municipais,2025-04-08
Prefeitura Municipal de Ribeirão do Sul,"5,0",Agências municipais,2025-04-08
Secretaria Municipal da Saúde Assis SP,"4,0",Agências municipais,2025-04-08
